Symbol,Name,Last Sale,Net Change,% Change,Market Cap,Country,IPO Year,Volume,Sector,Industry
JSPRW,Japer Therapeutics Inc. Warrants,$0.1446,0.0076,5.547%,2169196.00,United States,2020,2230,Health Care,Biotechnology: Biological Products (No Diagnostic Substances)
JTAI,Jet.AI Inc. Common Stock,$7.08,0.31,4.579%,5527356.00,United States,2021,780122,Consumer Discretionary,Transportation Services
JUNE,Junee Limited Ordinary Shares,$4.07,-0.04,-0.973%,52939931.00,Hong Kong,2024,15015,,
JUNS,Jupiter Neurosciences Inc. Common Stock,$0.651,-0.018,-2.691%,21550613.00,United States,2024,174509,Health Care,Biotechnology: Pharmaceutical Preparations
JVA,Coffee Holding Co. Inc. Common Stock,$5.89,0.07,1.203%,33623648.00,United States,2005,111925,Consumer Staples,Packaged Foods
JVSAR,JV SPAC Acquisition Corp. Right,$0.27,-0.03,-10.00%,0.00,China,2024,47556,,
JWEL,Jowell Global Ltd. Ordinary Shares,$2.82,-0.03,-1.053%,6120740.00,China,2021,2232,Consumer Discretionary,Other Consumer Services
JWN,Nordstrom Inc. Common Stock,$24.29,-0.02,-0.082%,4005589475.00,United States,,1778235,Consumer Discretionary,Clothing/Shoe/Accessory Stores
JXG,JX Luxventure Group Inc. Common Stock,$2.51,-0.02,-0.791%,3804653.00,China,2013,5523,Consumer Staples,Apparel
JXN,Jackson Financial Inc. Class A Common Stock ,$91.63,2.92,3.292%,6656579278.00,United States,2021,1118524,Finance,Life Insurance
JXN^A,Jackson Financial Inc. Depositary Shares each representing a 1/1000th interest in a share of Fixed-Rate Reset Noncumulative Perpetual Preferred Stock Series A,$26.37,-0.01,-0.038%,,United States,,18591,,
JYD,Jayud Global Logistics Limited Class A Ordinary Shares,$3.62,0.02,0.556%,77295047.00,China,2023,31679,Consumer Discretionary,Oil Refining/Marketing
JYNT,The Joint Corp. Common Stock,$11.35,-0.04,-0.351%,170063962.00,United States,2014,33086,Miscellaneous,Multi-Sector Companies
JZ,Jianzhi Education Technology Group Company Limited American Depositary Shs,$1.00,-0.03,-2.913%,20185000.00,China,2022,3202,Real Estate,Other Consumer Services
JZXN,Jiuzi Holdings Inc. Ordinary Shares,$3.56,-0.58,-14.01%,32232233.00,China,2021,31621,Consumer Discretionary,Retail-Auto Dealers and Gas Stations
K,Kellanova Common Stock,$82.90,0.40,0.485%,28618400017.00,United States,,3385966,Consumer Staples,Packaged Foods
KAI,Kadant Inc Common Stock,$374.48,1.40,0.375%,4401973829.00,United States,1992,138072,Industrials,Industrial Machinery/Components
KALA,KALA BIO Inc. Common Stock,$6.93,-0.04,-0.574%,31948263.00,United States,2017,10771,Health Care,Biotechnology: Pharmaceutical Preparations
KALU,Kaiser Aluminum Corporation Common Stock,$70.76,-0.54,-0.757%,1139269469.00,United States,,79072,Industrials,Metal Fabrications
KALV,KalVista Pharmaceuticals Inc. Common Stock,$11.395,0.705,6.595%,563117950.00,United Kingdom,2015,809537,Health Care,Biotechnology: Pharmaceutical Preparations
KAPA,Kairos Pharma Ltd. Common Stock,$1.19,-0.02,-1.653%,15287674.00,,2024,36468,Health Care,Biotechnology: Pharmaceutical Preparations
KAR,OPENLANE Inc. Common Stock,$22.30,0.98,4.597%,2384110327.00,United States,2009,1218012,Consumer Discretionary,Retail-Auto Dealers and Gas Stations
KARO,Karooooo Ltd. Ordinary Shares,$45.27,-0.39,-0.854%,1398843000.00,Singapore,2021,56572,Technology,Computer Software: Prepackaged Software
KAVL,Kaival Brands Innovations Group Inc. Common Stock,$0.8265,0.026,3.248%,9539713.00,United States,,193439,Consumer Discretionary,Other Consumer Services
KB,KB Financial Group Inc,$54.32,-1.30,-2.337%,20569018974.00,South Korea,,231019,Finance,Commercial Banks
KBDC,Kayne Anderson BDC Inc. Common Stock,$17.38,0.15,0.871%,0.00,,2024,87664,,
KBH,KB Home Common Stock,$61.00,-0.01,-0.016%,4401566081.00,United States,1986,900216,Consumer Discretionary,Homebuilding
KBR,KBR Inc. Common Stock,$49.03,0.74,1.532%,6493615227.00,United States,2006,2096292,Industrials,Military/Government/Technical
KBSX,FST Corp. Ordinary Shares,$6.78,0.00,0.00%,48760899.00,Taiwan,,65,Consumer Discretionary,Recreational Games/Products/Toys
KC,Kingsoft Cloud Holdings Limited American Depositary Shares,$16.33,-0.16,-0.97%,4142686713.00,China,2020,2886023,Technology,Computer Software: Prepackaged Software
KD,Kyndryl Holdings Inc. Common Stock,$38.08,0.35,0.928%,8861006674.00,United States,2021,2991766,Technology,EDP Services
KDLY,Kindly MD Inc. Common Stock,$1.68,-0.20,-10.638%,10042160.00,United States,2024,165738,Health Care,Medical/Nursing Services
KDLYW,Kindly MD Inc. Warrants,$0.2503,0.0056,2.289%,1496162.00,United States,2024,65780,Health Care,Medical/Nursing Services
KDP,Keurig Dr Pepper Inc. Common Stock,$33.52,-0.09,-0.268%,45478289397.00,United States,,36649553,Consumer Staples,Beverages (Production/Distribution)
KE,Kimball Electronics Inc. Common Stock,$18.02,0.02,0.111%,442475027.00,United States,,258432,Technology,Electrical Products
KELYA,Kelly Services Inc. Class A Common Stock,$13.47,0.06,0.447%,469941980.00,United States,,484021,Consumer Discretionary,Professional Services
KELYB,Kelly Services Inc. Class B Common Stock,$13.55,0.00,0.00%,472733023.00,United States,,21,Consumer Discretionary,Professional Services
KEN,Kenon Holdings Ltd. Ordinary Shares,$31.78,-0.23,-0.719%,1676898554.00,Singapore,2015,3641,Utilities,Electric Utilities: Central
KEP,Korea Electric Power Corporation Common Stock,$7.30,-0.68,-8.521%,9372675524.00,South Korea,1994,389220,Utilities,Electric Utilities: Central
KEQU,Kewaunee Scientific Corporation Common Stock,$54.36,-0.34,-0.622%,156111483.00,United States,,11932,Industrials,Medical Specialities
KEX,Kirby Corporation Common Stock,$104.22,1.89,1.847%,5953671720.00,United States,,812611,Consumer Discretionary,Marine Transportation
KEY,KeyCorp Common Stock,$17.32,0.34,2.002%,19140666588.00,United States,,9813955,Finance,Major Banks
KEY^I,KeyCorp Depositary Shares Each Representing a 1/40th Ownership Interest in a Share of Fixed-to-Floating Rate Perpetual Non-Cumulative Preferred Stock Series E,$25.28,0.16,0.637%,,United States,,38298,,
KEY^J,KeyCorp Depositary Shares each representing a 1/40th ownership interest in a share of Fixed Rate Perpetual Non-Cumulative Preferred Stock Series F,$22.81,0.02,0.088%,,United States,,32103,,
KEY^K,KeyCorp Depositary Shares each representing a 1/40th ownership interest in a share of Fixed Rate Perpetual Non-Cumulative Preferred Stock Series G,$23.01,0.23,1.01%,,United States,,28645,,
KEY^L,KeyCorp Depositary Shares each representing a 1/40th ownership interest in a share of Fixed Rate Perpetual Non-Cumulative Preferred Stock Series H,$25.05,0.08,0.32%,,United States,,42590,,
KEYS,Keysight Technologies Inc. Common Stock,$159.53,1.32,0.834%,27626251041.00,United States,2014,1775712,Industrials,Industrial Machinery/Components
KF,Korea Fund Inc. (The) New Common Stock,$20.3936,-0.3664,-1.765%,0.00,United States,,6428,Finance,Investment Managers
KFFB,Kentucky First Federal Bancorp Common Stock,$3.03,0.02,0.664%,24502746.00,United States,2005,2138,Finance,Savings Institutions
KFIIU,K&F Growth Acquisition Corp. II Unit,$10.02,0.01,0.10%,0.00,United States,2025,2380,Finance,Blank Checks
KFRC,Kforce Inc. Common Stock,$50.12,0.13,0.26%,957843320.00,United States,1995,150138,Consumer Discretionary,Professional Services
KFS,Kingsway Financial Services Inc. Common Stock (DE),$7.77,0.11,1.436%,214240586.00,Canada,,19152,Finance,Property-Casualty Insurers
KFY,Korn Ferry Common Stock,$65.65,1.25,1.941%,3386424672.00,United States,1999,405326,Consumer Discretionary,Diversified Commercial Services
KGC,Kinross Gold Corporation Common Stock,$10.72,0.10,0.942%,13174880000.00,Canada,2001,20074657,Basic Materials,Precious Metals
KGEI,Kolibri Global Energy Inc. Common stock,$7.60,0.12,1.604%,271593334.00,United States,,82231,Energy,Oil & Gas Production
KGS,Kodiak Gas Services Inc. Common Stock,$43.00,0.59,1.391%,3765496197.00,United States,2023,1181030,Utilities,Natural Gas Distribution
KHC,The Kraft Heinz Company Common Stock,$30.71,0.06,0.196%,36698141457.00,United States,,12184241,Consumer Staples,Packaged Foods
KIDS,OrthoPediatrics Corp. Common Stock,$23.22,0.33,1.442%,562294034.00,United States,2017,260404,Health Care,Medical/Dental Instruments
KIM,Kimco Realty Corporation (HC) Common Stock,$22.10,0.49,2.267%,15016552951.00,United States,,6266167,Real Estate,Real Estate Investment Trusts
KIM^L,Kimco Realty Corporation Class L Depositary Shares each of which represents a one-one thousandth fractional interest in a share of 5.125% Class L Cumulative Redeemable Preferred Stock liquidation preference $25000.00 per share,$21.24,0.04,0.189%,,United States,,8161,,
KIM^M,Kimco Realty Corporation Class M Depositary Shares each of which represents a one-one thousandth fractional interest in a share of 5.25% Class M Cumulative Redeemable Preferred Stock liquidation preference $25000.00 per share,$21.75,-0.04,-0.184%,,United States,,18825,,
KIM^N,Kimco Realty Corporation Depositary Shares each representing 1/1000th interest in a share of 7.25% Class N Cumulative Convertible Perpetual Preferred Stock,$59.78,-0.75,-1.239%,,United States,,433,,
KIND,Nextdoor Holdings Inc. Class A Common Stock,$1.77,-0.72,-28.916%,676393308.00,United States,,15948983,Technology,Computer Software: Programming Data Processing
KINS,Kingstone Companies Inc. Common Stock,$16.06,0.56,3.613%,198327060.00,United States,,264111,Finance,Property-Casualty Insurers
KIO,KKR Income Opportunities Fund Common Shares,$12.44,0.02,0.161%,0.00,United States,2013,381536,Finance,Investment Managers
KIRK,Kirkland's Inc. COMMONSTOCK,$1.37,-0.01,-0.725%,17971581.00,United States,2002,145542,Consumer Discretionary,Other Specialty Stores
KITT,Nauticus Robotics Inc. Common stock,$0.963,-0.067,-6.505%,6170398.00,United States,2021,1695085,Industrials,Industrial Machinery/Components
KITTW,Nauticus Robotics Inc. Warrant,$0.06,-0.0038,-5.956%,384449.00,United States,2021,114079,Industrials,Industrial Machinery/Components
KKR,KKR & Co. Inc. Common Stock,$135.59,3.39,2.564%,120434957771.00,United States,,6393200,Finance,Investment Managers
KKRS,KKR Group Finance Co. IX LLC 4.625% Subordinated Notes due 2061,$19.30,0.16,0.836%,17142817944.00,United States,2021,33357,,
KLAC,KLA Corporation Common Stock,$708.84,9.68,1.385%,94195441035.00,United States,1980,1242428,Technology,Electronic Components
KLC,KinderCare Learning Companies Inc. Common Stock,$19.46,-0.32,-1.618%,2295620092.00,,2024,840325,Consumer Discretionary,Other Consumer Services
KLG,WK Kellogg Co Common Stock,$19.82,0.06,0.304%,1708423727.00,United States,2023,971456,Consumer Staples,Packaged Foods
KLIC,Kulicke and Soffa Industries Inc. Common Stock,$38.27,0.42,1.11%,2042973839.00,Singapore,,611907,Technology,Semiconductors
KLTO,Klotho Neurosciences Inc. Common Stock,$0.2983,-0.0487,-14.035%,6342907.00,United States,2022,496934,Health Care,Biotechnology: Biological Products (No Diagnostic Substances)
KLTOW,Klotho Neurosciences Inc. Warrant,$0.0347,0.0003,0.872%,737844.00,United States,2022,6679,Health Care,Biotechnology: Biological Products (No Diagnostic Substances)
KLTR,Kaltura Inc. Common Stock,$2.12,0.04,1.923%,326773128.00,United States,2021,315053,Technology,Computer Software: Prepackaged Software
KLXE,KLX Energy Services Holdings Inc. Common Stock,$4.67,0.87,22.895%,78737769.00,United States,,448606,Energy,Oilfield Services/Equipment
KMB,Kimberly-Clark Corporation Common Stock,$142.01,1.82,1.298%,47102530188.00,United States,,2683862,Consumer Discretionary,Containers/Packaging
KMDA,Kamada Ltd. Ordinary Shares,$6.89,-0.02,-0.289%,308947600.00,Israel,2013,106128,Health Care,Biotechnology: Pharmaceutical Preparations
KMI,Kinder Morgan Inc. Common Stock,$27.10,0.89,3.396%,60215197978.00,United States,2011,16400222,Utilities,Natural Gas Distribution
KMPB,Kemper Corporation 5.875% Fixed-Rate Reset Junior Subordinated Debentures due 2062,$23.58,-0.0744,-0.315%,1506775134.00,United States,2022,28889,Finance,Property-Casualty Insurers
KMPR,Kemper Corporation,$67.58,1.25,1.885%,4318399642.00,United States,,392683,Finance,Property-Casualty Insurers
KMT,Kennametal Inc. Common Stock,$22.13,0.21,0.958%,1711984037.00,United States,,1341057,Industrials,Industrial Machinery/Components
KMX,CarMax Inc,$82.97,1.01,1.232%,12760783843.00,United States,,1581699,Consumer Discretionary,Retail-Auto Dealers and Gas Stations
KN,Knowles Corporation Common Stock,$16.59,0.02,0.121%,1454332040.00,United States,2014,1202902,Consumer Staples,Consumer Electronics/Appliances
KNDI,Kandi Technologies Group Inc. Ordinary Shares,$1.29,-0.09,-6.522%,112692122.00,China,,304261,Consumer Discretionary,Auto Manufacturing
KNF,Knife Riv Holding Co. Common Stock,$95.68,2.57,2.76%,5416703614.00,United States,2023,552946,Industrials,Mining & Quarrying of Nonmetallic Minerals (No Fuels)
KNOP,KNOT Offshore Partners LP Common Units representing Limited Partner Interests,$5.59,0.17,3.137%,190312003.00,United Kingdom,2013,72569,Consumer Discretionary,Marine Transportation
KNSA,Kiniksa Pharmaceuticals International plc Class A Ordinary Shares,$20.28,0.65,3.311%,1473225187.00,United States,2018,733762,Health Care,Biotechnology: Pharmaceutical Preparations
KNSL,Kinsale Capital Group Inc. Common Stock,$431.85,3.78,0.883%,10052343031.00,United States,,154890,Finance,Property-Casualty Insurers
KNTK,Kinetik Holdings Inc. Class A Common Stock,$58.34,2.31,4.123%,9190726490.00,United States,2022,1289423,Utilities,Natural Gas Distribution
KNX,Knight-Swift Transportation Holdings Inc.,$50.44,1.46,2.981%,8170050929.00,United States,2017,13626060,Industrials,Trucking Freight/Courier Services
KO,Coca-Cola Company (The) Common Stock,$71.21,0.34,0.48%,306274238128.00,United States,,22163734,Consumer Staples,Beverages (Production/Distribution)
KOD,Kodiak Sciences Inc Common Stock,$4.11,0.10,2.494%,216283711.00,United States,2018,318542,Health Care,Biotechnology: Biological Products (No Diagnostic Substances)
KODK,Eastman Kodak Company Common New,$7.02,0.13,1.887%,564408000.00,United States,,757973,Consumer Discretionary,Industrial Machinery/Components
KOF,Coca Cola Femsa S.A.B. de C.V.  American Depositary Shares each representing 10 Units (each Unit consists of 3 Series B Shares and 5 Series L Shares),$89.14,0.30,0.338%,18726818766.00,Mexico,1993,323723,Consumer Staples,Beverages (Production/Distribution)
KOP,Koppers Holdings Inc. Common Stock,$29.11,-0.14,-0.479%,590028465.00,United States,2006,245257,Basic Materials,Forest Products
KOPN,Kopin Corporation Common Stock,$1.38,0.06,4.545%,219144828.00,United States,1992,1453356,Technology,Semiconductors
KORE,KORE Group Holdings Inc. Common Stock,$2.50,0.065,2.669%,42520890.00,United States,,23044,Telecommunications,Telecommunications Equipment
KOS,Kosmos Energy Ltd. Common Shares (DE),$2.81,0.02,0.717%,1342912072.00,Bermuda,2011,8810125,Energy,Oil & Gas Production
KOSS,Koss Corporation Common Stock,$5.53,0.08,1.468%,51848146.00,United States,,38737,Consumer Staples,Consumer Electronics/Appliances
KPLT,Katapult Holdings Inc. Common Stock,$11.28,0.50,4.638%,49525054.00,United States,2019,7301,Consumer Discretionary,Diversified Commercial Services
KPLTW,Katapult Holdings Inc. Warrant,$0.0093,-0.0001,-1.064%,40832.00,United States,2019,49422,Consumer Discretionary,Diversified Commercial Services
KPRX,Kiora Pharmaceuticals Inc.  Common Stock,$3.25,-0.104,-3.101%,9752561.00,United States,,13781,Health Care,Biotechnology: Pharmaceutical Preparations
KPTI,Karyopharm Therapeutics Inc. Common Stock,$7.95,-0.40,-4.79%,66907232.00,United States,2013,120796,Health Care,Biotechnology: Pharmaceutical Preparations
KR,Kroger Company (The) Common Stock,$64.82,0.89,1.392%,46904149347.00,United States,,8625955,Consumer Staples,Food Chains
KRC,Kilroy Realty Corporation Common Stock,$35.70,0.15,0.422%,4217479333.00,United States,1997,1712274,Real Estate,Real Estate Investment Trusts
KREF,KKR Real Estate Finance Trust Inc. Common Stock,$11.09,-0.01,-0.09%,762033780.00,United States,2017,600503,Real Estate,Real Estate Investment Trusts
KREF^A,KKR Real Estate Finance Trust Inc. 6.50% Series A Cumulative Redeemable Preferred Stock,$19.80,-0.25,-1.247%,,United States,,32381,,
KRG,Kite Realty Group Trust Common Stock,$22.93,0.77,3.475%,5036908521.00,United States,2004,3608449,Real Estate,Real Estate Investment Trusts
KRKR,36Kr Holdings Inc. American Depositary Shares,$4.51,0.28,6.619%,8795785.00,China,2019,56353,Consumer Discretionary,Business Services
KRMD,KORU Medical Systems Inc. Common Stock (DE),$3.46,0.03,0.875%,158597072.00,United States,,235500,Health Care,Medical/Dental Instruments
KRMN,Karman Holdings Inc. Common Stock,$31.54,1.31,4.333%,4168786663.00,,2025,669753,Industrials,Military/Government/Technical
KRNT,Kornit Digital Ltd. Ordinary Shares,$24.76,-0.07,-0.282%,1181538113.00,Israel,2015,261863,Industrials,Industrial Machinery/Components
KRNY,Kearny Financial Corp Common Stock,$6.99,0.18,2.643%,451411984.00,United States,2005,275851,Finance,Savings Institutions
KRO,Kronos Worldwide Inc Common Stock,$8.75,0.01,0.114%,1006567765.00,United States,,158923,Industrials,Major Chemicals
KRON,Kronos Bio Inc. Common Stock,$0.98,0.0175,1.818%,59134100.00,United States,2020,51497,Health Care,Biotechnology: Pharmaceutical Preparations
KROS,Keros Therapeutics Inc. Common Stock,$11.08,0.07,0.636%,449427481.00,United States,2020,2027042,Health Care,Biotechnology: Pharmaceutical Preparations
KRP,Kimbell Royalty Partners Common Units Representing Limited Partner Interests,$15.32,0.24,1.592%,1462964572.00,United States,2017,891294,Energy,Oil & Gas Production
KRRO,Korro Bio Inc. Common Stock,$25.07,0.34,1.375%,234862328.00,United States,2019,141943,Health Care,Biotechnology: Pharmaceutical Preparations
KRT,Karat Packaging Inc. Common Stock,$29.91,0.69,2.361%,598920981.00,United States,2021,37215,Industrials,Plastic Products
KRUS,Kura Sushi USA Inc. Class A Common Stock,$62.20,-0.48,-0.766%,750513410.00,United States,2019,342299,Consumer Discretionary,Restaurants
KRYS,Krystal Biotech Inc. Common Stock,$179.25,5.90,3.404%,5163489482.00,United States,2017,260737,Health Care,Biotechnology: Biological Products (No Diagnostic Substances)
KSCP,Knightscope Inc. Class A Common Stock,$6.30,-0.27,-4.11%,24056235.00,United States,2022,157937,Telecommunications,Telecommunications Equipment
KSPI,Joint Stock Company Kaspi.kz American Depository Shares,$104.74,0.86,0.828%,19830787124.00,Kazakhstan,2024,464035,,
KSS,Kohl's Corporation Common Stock,$11.41,0.01,0.088%,1270132721.00,United States,1992,5975706,Consumer Discretionary,Department/Specialty Retail Stores
KT,KT Corporation Common Stock,$17.16,-0.05,-0.291%,8456908643.00,South Korea,,1982572,Telecommunications,Telecommunications Equipment
KTB,Kontoor Brands Inc. Common Stock ,$65.04,-2.23,-3.315%,3598406162.00,United States,2019,984623,Consumer Discretionary,Apparel
KTCC,Key Tronic Corporation Common Stock,$3.06,0.08,2.685%,32931325.00,United States,1983,15770,Technology,Electrical Products
KTF,DWS Municipal Income Trust,$9.71,0.00,0.00%,383554108.00,United States,1988,59882,Finance,Finance Companies
KTH,Structures Products Cp 8% CorTS Issued by Peco Energy Cap Tr II Preferred Stock,$29.04,0.05,0.172%,0.00,United States,,1466,Finance,Finance: Consumer Services
KTN,Structured Products Corp 8.205% CorTS 8.205% Corporate Backed Trust Securities (CorTS),$25.99,-0.34,-1.291%,0.00,United States,,12257,Finance,Finance: Consumer Services
KTOS,Kratos Defense & Security Solutions Inc. Common Stock,$26.39,0.12,0.457%,4033513760.00,United States,,2860959,Industrials,Military/Government/Technical
KTTA,Pasithea Therapeutics Corp. Common Stock,$1.16,-0.06,-4.918%,1469055.00,United States,2021,50587,Health Care,Biotechnology: Pharmaceutical Preparations
KTTAW,Pasithea Therapeutics Corp. Warrant,$0.0222,-0.0026,-10.484%,28115.00,United States,2021,13399,Health Care,Biotechnology: Pharmaceutical Preparations
KUKE,Kuke Music Holding Limited American Depositary Shares each representing one Ordinary Share,$0.277,0.0019,0.691%,9210727.00,,2021,156028,Real Estate,Other Consumer Services
KULR,KULR Technology Group Inc. Common Stock,$1.36,-0.03,-2.158%,291349819.00,United States,,11079007,Technology,Electrical Products
KURA,Kura Oncology Inc. Common Stock,$7.71,0.06,0.784%,599558513.00,United States,,1980142,Health Care,Biotechnology: Pharmaceutical Preparations
KVAC,Keen Vision Acquisition Corporation Ordinary Shares,$11.16,0.01,0.09%,0.00,United States,2023,831,,
KVACU,Keen Vision Acquisition Corporation Units,$11.30,0.12,1.073%,0.00,United States,2023,100,,
KVACW,Keen Vision Acquisition Corporation Warrant,$0.05,-0.006,-10.714%,0.00,United States,2023,20700,,
KVHI,KVH Industries Inc. Common Stock,$5.83,-0.02,-0.342%,115428881.00,United States,1996,51739,Technology,Radio And Television Broadcasting And Communications Equipment
KVUE,Kenvue Inc. Common Stock,$23.60,0.46,1.988%,45105280992.00,United States,2023,30980811,Consumer Discretionary,Specialty Chemicals
KVYO,Klaviyo Inc. Series A Common Stock,$39.32,-0.49,-1.231%,10738884788.00,United States,2023,1353779,Technology,Computer Software: Prepackaged Software
KW,Kennedy-Wilson Holdings Inc. Common Stock,$9.71,0.14,1.463%,1334269772.00,United States,,784281,Finance,Real Estate
KWE,KWESST Micro Systems Inc. Common Stock,$0.4301,-0.0253,-5.556%,3392295.00,Canada,,468835,Technology,Computer Software: Prepackaged Software
KWESW,KWESST Micro Systems Inc. Warrant,$0.03,-0.0144,-32.432%,236617.00,Canada,,13255,Technology,Computer Software: Prepackaged Software
KWR,Quaker Houghton Common Stock,$139.02,0.00,0.00%,2456713339.00,United States,,147589,Industrials,Major Chemicals
KXIN,Kaixin Holdings Ordinary Shares,$1.20,-0.03,-2.439%,1183902.00,China,2017,96473,Consumer Discretionary,Retail-Auto Dealers and Gas Stations
KYMR,Kymera Therapeutics Inc. Common Stock,$31.35,1.10,3.636%,2030391340.00,United States,2020,2134259,Health Care,Biotechnology: Biological Products (No Diagnostic Substances)
KYN,Kayne Anderson Energy Infrastructure Fund Inc.,$12.77,0.35,2.818%,1738399638.00,United States,2004,520866,Finance,Finance/Investors Services
KYTX,Kyverna Therapeutics Inc. Common Stock,$2.84,0.04,1.429%,122607378.00,United States,2024,175806,Health Care,Biotechnology: Biological Products (No Diagnostic Substances)
KZIA,Kazia Therapeutics Limited American Depositary Shares,$0.8514,0.0114,1.357%,2833892.00,Australia,,48270,Health Care,Biotechnology: Pharmaceutical Preparations
KZR,Kezar Life Sciences Inc. Common Stock,$5.71,-0.18,-3.056%,41661428.00,United States,2018,123675,Health Care,Biotechnology: Pharmaceutical Preparations
L,Loews Corporation Common Stock,$86.67,0.88,1.026%,18448688871.00,United States,,1075986,Finance,Property-Casualty Insurers
LAB,Standard BioTools Inc. Common Stock,$1.065,0.02,1.914%,396455620.00,United States,2011,8064049,Industrials,Biotechnology: Laboratory Analytical Instruments
LAC,Lithium Americas Corp. Common Shares,$2.65,-0.09,-3.285%,578479100.00,Canada,2023,4277501,Basic Materials,Metal Mining
LAD,Lithia Motors Inc. Common Stock,$344.44,-0.07,-0.02%,9054206792.00,United States,,379913,Consumer Discretionary,Retail-Auto Dealers and Gas Stations
LADR,Ladder Capital Corp Class A Common Stock,$11.87,0.20,1.714%,1508753929.00,United States,2014,602983,Real Estate,Real Estate Investment Trusts
LAES,SEALSQ Corp Ordinary Shares,$2.88,-0.11,-3.679%,67334400.00,Switzerland,,8030704,Technology,Semiconductors
LAKE,Lakeland Industries Inc. Common Stock,$23.60,0.11,0.468%,174772254.00,United States,1986,34948,Health Care,Industrial Specialties
LAMR,Lamar Advertising Company Class A Common Stock,$124.23,2.07,1.694%,12720780304.00,United States,1996,570128,Real Estate,Real Estate Investment Trusts
LANC,Lancaster Colony Corporation Common Stock,$191.155,1.125,0.592%,5270525660.00,United States,,179962,Consumer Staples,Packaged Foods
LAND,Gladstone Land Corporation Common Stock,$11.46,-0.14,-1.207%,414676181.00,United States,1993,1263846,Real Estate,Real Estate Investment Trusts
LANDM,Gladstone Land Corporation 5.00% Series D Cumulative Term Preferred Stock,$24.8666,0.1166,0.471%,899789417.00,United States,,1846,Real Estate,Real Estate Investment Trusts
LANDO,Gladstone Land Corporation 6.00% Series B Cumulative Redeemable Preferred Stock,$20.55,-0.025,-0.122%,743594722.00,United States,,10903,Real Estate,Real Estate Investment Trusts
LANDP,Gladstone Land Corporation 6.00% Series C Cumulative Redeemable Preferred Stock,$20.30,0.05,0.247%,734548557.00,United States,,30683,Real Estate,Real Estate Investment Trusts
LANV,Lanvin Group Holdings Limited Ordinary Shares,$1.98,0.09,4.762%,259322719.00,Cayman Islands,2022,23011,Finance,Blank Checks
LAR,Lithium Argentina AG Common Shares,$2.20,-0.03,-1.345%,354860000.00,Canada,2023,990504,Basic Materials,Metal Mining
LARK,Landmark Bancorp Inc. Common Stock,$24.15,0.09,0.374%,139497210.00,United States,,7372,Finance,Major Banks
LASE,Laser Photonics Corporation Common Stock,$3.59,0.22,6.528%,49658298.00,United States,2022,190521,Miscellaneous,Industrial Machinery/Components
LASR,nLIGHT Inc. Common Stock,$9.17,0.09,0.991%,444097195.00,United States,2018,760890,Technology,Semiconductors
LAUR,Laureate Education Inc. Common Stock,$19.94,0.08,0.403%,3006649849.00,United States,2017,1406643,Real Estate,Other Consumer Services
LAW,CS Disco Inc. Common Stock,$4.82,-0.10,-2.033%,291048205.00,United States,2021,125855,Technology,Computer Software: Prepackaged Software
LAZ,Lazard Inc. Common Stock,$50.15,1.55,3.189%,5655219464.00,Bermuda,2005,999410,Finance,Investment Managers
LAZR,Luminar Technologies Inc.  Class A Common Stock,$5.20,0.06,1.167%,173139782.00,United States,2019,967392,Consumer Discretionary,Auto Parts:O.E.M.
LB,LandBridge Company LLC Class A Shares Representing Limited Liability Company Interests,$69.18,4.29,6.611%,5060627896.00,,2024,706822,Energy,Oil & Gas Production
