Symbol,Name,Last Sale,Net Change,% Change,Market Cap,Country,IPO Year,Volume,Sector,Industry
DGICB,Donegal Group Inc. Class B Common Stock,$14.475,-0.15,-1.026%,490639823.00,United States,1986,402,Finance,Property-Casualty Insurers
DGII,Digi International Inc. Common Stock,$30.54,-0.16,-0.521%,1126901263.00,United States,1989,379795,Telecommunications,Computer Communications Equipment
DGLY,Digital Ally Inc. Common Stock,$0.0764,-0.004,-4.975%,422604.00,United States,,31696311,Technology,Radio And Television Broadcasting And Communications Equipment
DGNX,Diginex Limited Ordinary Shares,$68.72,0.85,1.252%,1593819524.00,Hong Kong,2025,98774,Technology,EDP Services
DGX,Quest Diagnostics Incorporated Common Stock,$172.90,1.35,0.787%,19188108130.00,United States,,1197925,Health Care,Medical Specialities
DH,Definitive Healthcare Corp. Class A Common Stock,$3.23,-1.69,-34.35%,373138738.00,United States,2021,7274972,Technology,Computer Software: Prepackaged Software
DHAI,DIH Holdings US Inc. Class A Common Stock,$0.4863,0.0781,19.133%,23019645.00,United States,2024,2918771,Health Care,Medical/Dental Instruments
DHAIW,DIH Holding US Inc. Warrants,$0.0194,0.0015,8.38%,918324.00,United States,2024,35940,Health Care,Medical/Dental Instruments
DHC,Diversified Healthcare Trust Common Shares of Beneficial Interest,$2.83,0.08,2.909%,682798919.00,United States,,1698459,Real Estate,Real Estate Investment Trusts
DHCNI,Diversified Healthcare Trust 5.625% Senior Notes due 2042,$14.81,0.14,0.954%,3573233921.00,United States,,16440,Real Estate,Real Estate Investment Trusts
DHCNL,Diversified Healthcare Trust 6.25% Senior Notes Due 2046,$16.62,0.265,1.62%,4009935704.00,United States,,16200,Real Estate,Real Estate Investment Trusts
DHF,BNY Mellon High Yield Strategies Fund Common Stock,$2.60,0.01,0.386%,0.00,United States,1998,206517,Finance,Finance Companies
DHI,D.R. Horton Inc. Common Stock,$126.81,0.37,0.293%,39960682450.00,United States,,5729616,Consumer Discretionary,Homebuilding
DHIL,Diamond Hill Investment Group Inc. Class A Common Stock,$146.14,0.93,0.64%,407364081.00,United States,,76468,Finance,Investment Managers
DHR,Danaher Corporation Common Stock,$207.76,2.05,0.997%,148488118852.00,United States,,3819039,Industrials,Industrial Machinery/Components
DHT,DHT Holdings Inc.,$10.34,0.15,1.472%,1664735264.00,Jersey,2005,1174018,Consumer Discretionary,Marine Transportation
DHX,DHI Group Inc. Common Stock,$2.42,0.15,6.608%,118391896.00,United States,2007,317534,Consumer Discretionary,Business Services
DHY,Credit Suisse High Yield Bond Fund Common Stock,$2.15,0.00,0.00%,0.00,United States,1998,299683,Finance,Finance/Investors Services
DIAX,Nuveen Dow 30SM Dynamic Overwrite Fund Common Shares of Beneficial Interest,$15.20,0.15,0.997%,0.00,,2014,53174,Finance,Finance Companies
DIBS,1stdibs.com Inc. Common Stock,$3.68,-0.08,-2.128%,134367987.00,United States,2021,88027,Consumer Discretionary,Catalog/Specialty Distribution
DIN,Dine Brands Global Inc. Common Stock,$25.08,-0.74,-2.866%,382381543.00,United States,,1279414,Consumer Discretionary,Restaurants
DINO,HF Sinclair Corporation Common Stock,$35.27,0.41,1.176%,6645126988.00,United States,1960,15189549,Energy,Natural Gas Distribution
DIOD,Diodes Incorporated Common Stock,$49.38,-0.76,-1.516%,2287969463.00,United States,,743589,Technology,Semiconductors
DIS,Walt Disney Company (The) Common Stock,$113.80,2.49,2.237%,205726372837.00,United States,,14605427,Consumer Discretionary,Services-Misc. Amusement & Recreation
DISTR,Distoken Acquisition Corporation Right,$0.1301,-0.0379,-22.56%,0.00,China,2023,107438,Finance,Blank Checks
DIT,AMCON Distributing Company Common Stock,$131.99,-2.01,-1.50%,85194529.00,United States,1999,173,Consumer Discretionary,Food Distributors
DJCO,Daily Journal Corp. (S.C.) Common Stock,$393.27,9.64,2.513%,541700323.00,United States,,13545,Consumer Discretionary,Newspapers/Magazines
DJT,Trump Media & Technology Group Corp. Common Stock,$24.10,0.30,1.261%,5303575297.00,United States,2024,3526576,Technology,Computer Software: Programming Data Processing
DJTWW,Trump Media & Technology Group Corp. Warrants,$14.665,0.335,2.338%,3227258578.00,United States,2021,41011,Technology,Computer Software: Programming Data Processing
DK,Delek US Holdings Inc. Common Stock,$16.30,0.45,2.839%,1018965682.00,United States,2017,2454631,Energy,Integrated oil Companies
DKL,Delek Logistics Partners L.P. Common Units representing Limited Partner Interests,$43.02,1.35,3.24%,2308776839.00,United States,2012,151158,Energy,Natural Gas Distribution
DKNG,DraftKings Inc. Class A Common Stock,$43.86,1.12,2.62%,21489479853.00,United States,2019,6213432,Consumer Discretionary,Services-Misc. Amusement & Recreation
DKS,Dick's Sporting Goods Inc Common Stock,$225.10,3.29,1.483%,18339934486.00,United States,2002,997178,Consumer Discretionary,Other Specialty Stores
DLB,Dolby Laboratories Common Stock,$81.61,0.54,0.666%,7865333254.00,United States,2005,560060,Miscellaneous,Multi-Sector Companies
DLHC,DLH Holdings Corp.,$5.06,0.045,0.897%,72795528.00,United States,,37575,Consumer Discretionary,Professional Services
DLNG,Dynagas LNG Partners LP Common Units,$4.00,0.00,0.00%,147351092.00,Greece,,90799,Consumer Discretionary,Marine Transportation
DLNG^A,Dynagas LNG Partners LP 9.00% Series A Cumulative Redeemable Preferred Units,$24.828,0.038,0.153%,,Greece,,12936,,
DLNG^B,Dynagas LNG Partners LP 8.75% Series B Fixed to Floating Rate Cumulative Redeemable Perpetual Preferred Units liquidation preference $25.00 per Uni,$25.25,0.02,0.079%,,Greece,,4529,,
DLO,DLocal Limited Class A Common Shares,$9.555,-4.195,-30.509%,2828200359.00,Uruguay,2021,7790656,Consumer Discretionary,Business Services
DLPN,Dolphin Entertainment Inc. Common Stock,$1.12,0.0572,5.382%,12501469.00,United States,,52182,Consumer Discretionary,Other Consumer Services
DLR,Digital Realty Trust Inc. Common Stock,$156.32,-0.95,-0.604%,52624228378.00,United States,2004,5768695,Real Estate,Real Estate Investment Trusts
DLR^J,Digital Realty Trust Inc. 5.250% Series J Cumulative Redeemable Preferred Stock,$21.66,-0.15,-0.688%,,United States,,81830,,
DLR^K,Digital Realty Trust Inc. 5.850% Series K Cumulative Redeemable Preferred Stock par value $0.01 per share,$24.36,-0.09,-0.368%,,United States,,21024,,
DLR^L,Digital Realty Trust Inc. 5.200% Series L Cumulative Redeemable Preferred Stock,$21.31,-0.01,-0.047%,,United States,,106535,,
DLTH,Duluth Holdings Inc. Class B Common Stock,$2.75,-0.04,-1.434%,96737174.00,United States,2015,21675,Consumer Discretionary,Clothing/Shoe/Accessory Stores
DLTR,Dollar Tree Inc. Common Stock,$72.86,-0.30,-0.41%,15667715165.00,United States,1995,2969687,Consumer Discretionary,Department/Specialty Retail Stores
DLX,Deluxe Corporation Common Stock,$16.46,0.24,1.48%,731331017.00,United States,,428976,Consumer Discretionary,Publishing
DLY,DoubleLine Yield Opportunities Fund Common Shares of Beneficial Interest,$16.29,0.00,0.00%,781036740.00,United States,2020,100731,Finance,Investment Managers
DM,Desktop Metal Inc. Class A Common Stock,$2.28,0.10,4.587%,76018435.00,United States,2019,107657,Technology,Industrial Machinery/Components
DMA,Destra Multi-Alternative Fund Common Stock,$8.80,0.00,0.00%,0.00,,2022,28482,Finance,Trusts Except Educational Religious and Charitable
DMAA,Drugs Made In America Acquisition Corp. Ordinary Shares,$9.97,0.01,0.10%,0.00,United States,2025,536,,
DMAAR,Drugs Made In America Acquisition Corp. Rights,$0.15,0.00,0.00%,0.00,United States,2025,997908,Finance,Blank Checks
DMAAU,Drugs Made In America Acquisition Corp. Units,$10.20,0.09,0.89%,0.00,United States,2025,6984,,
DMAC,DiaMedica Therapeutics Inc. Common Stock,$6.53,0.15,2.351%,279226600.00,United States,2018,44541,Health Care,Biotechnology: Pharmaceutical Preparations
DMB,BNY Mellon Municipal Bond Infrastructure Fund Inc. Common Stock,$10.85,0.06,0.556%,0.00,,2013,17997,Finance,Trusts Except Educational Religious and Charitable
DMF,BNY Mellon Municipal Income Inc. Common Stock,$7.18,0.04,0.56%,447248332.00,United States,1988,30749,Finance,Finance/Investors Services
DMLP,Dorchester Minerals L.P. Common Units Representing Limited Partnership Interests,$30.41,-0.65,-2.093%,1439601980.00,United States,,317055,Energy,Oil & Gas Production
DMN,Damon Inc. Common Stock,$0.169,-0.016,-8.649%,3723219.00,United Kingdom,,3824461,Technology,EDP Services
DMO,Western Asset Mortgage Opportunity Fund Inc. Common Stock,$11.98,0.05,0.419%,0.00,United States,2010,45328,Finance,Trusts Except Educational Religious and Charitable
DMRC,Digimarc Corporation Common Stock,$16.35,0.96,6.238%,350736995.00,United States,,1015220,Technology,EDP Services
DMYY,dMY Squared Technology Group Inc. Class A Common Stock,$11.25,-0.15,-1.316%,0.00,,2022,56112,Finance,Blank Checks
DNA,Ginkgo Bioworks Holdings Inc. Class A Common Stock,$8.24,-0.40,-4.63%,478196864.00,United States,2021,2261666,Health Care,Biotechnology: Biological Products (No Diagnostic Substances)
DNB,Dun & Bradstreet Holdings Inc. Common Stock,$9.07,0.02,0.221%,4004553467.00,United States,2020,3519394,Finance,Finance: Consumer Services
DNLI,Denali Therapeutics Inc. Common Stock,$16.56,-2.04,-10.968%,2383342093.00,United States,2017,2218032,Health Care,Biotechnology: Biological Products (No Diagnostic Substances)
DNN,Denison Mines Corp Ordinary Shares (Canada),$1.49,0.04,2.759%,1329631200.00,Canada,,61379929,Basic Materials,Other Metals and Minerals
DNOW,DNOW Inc. Common Stock,$15.98,-0.02,-0.125%,1688884812.00,United States,2014,1056150,Industrials,Metal Fabrications
DNP,DNP Select Income Fund Inc. Common Stock,$9.58,0.13,1.376%,0.00,United States,1987,532768,Finance,Investment Managers
DNTH,Dianthus Therapeutics Inc. Common Stock,$21.60,0.55,2.613%,639294444.00,United States,2018,378335,Health Care,Biotechnology: Pharmaceutical Preparations
DNUT,Krispy Kreme Inc. Common Stock,$6.21,0.01,0.161%,1055700000.00,United States,2021,5986463,Consumer Staples,Food Chains
DOC,Healthpeak Properties Inc. Common Stock,$20.46,0.28,1.388%,14313092473.00,United States,,7268357,Real Estate,Real Estate Investment Trusts
DOCN,DigitalOcean Holdings Inc. Common Stock,$42.85,0.14,0.328%,3945105187.00,United States,2021,1198218,Technology,Computer Software: Programming Data Processing
DOCS,Doximity Inc. Class A Common Stock,$70.50,1.05,1.512%,13228415973.00,United States,2021,2942581,Technology,EDP Services
DOCU,DocuSign Inc. Common Stock,$83.17,1.89,2.325%,16802264637.00,United States,1989,2316946,Technology,Computer Software: Prepackaged Software
DOGZ,Dogness (International) Corporation Class A Common Stock,$28.00,2.62,10.323%,356458424.00,China,2017,146690,Consumer Discretionary,Miscellaneous manufacturing industries
DOLE,Dole plc Ordinary Shares,$14.63,0.05,0.343%,1388813889.00,Ireland,2021,724329,Consumer Staples,Farming/Seeds/Milling
DOMH,Dominari Holdings Inc. Common Stock,$7.80,0.03,0.386%,48953876.00,United States,,269352,Health Care,Biotechnology: Pharmaceutical Preparations
DOMO,Domo Inc. Class B Common Stock,$7.60,-0.12,-1.554%,297217570.00,United States,2018,231469,Technology,Computer Software: Prepackaged Software
DOOO,BRP Inc. (Recreational Products) Common Subordinate Voting Shares,$39.65,0.52,1.329%,2894852725.00,Canada,,131434,Consumer Discretionary,Industrial Specialties
DORM,Dorman Products Inc. Common Stock,$131.46,3.47,2.711%,4011828447.00,United States,,321976,Consumer Discretionary,Auto Parts:O.E.M.
DOUG,Douglas Elliman Inc. Common Stock,$1.83,-0.07,-3.684%,163175594.00,United States,2021,363165,Finance,Real Estate
DOV,Dover Corporation Common Stock,$198.77,2.26,1.15%,27276294547.00,United States,,935123,Industrials,Industrial Machinery/Components
DOW,Dow Inc. Common Stock ,$38.11,-0.32,-0.833%,26823034890.00,United States,2019,10056136,Industrials,Major Chemicals
DOX,Amdocs Limited Ordinary Shares,$87.25,-0.49,-0.558%,9849701709.00,Guernsey,,716057,Technology,EDP Services
DOYU,DouYu International Holdings Limited ADS,$7.15,-0.12,-1.651%,226194354.00,China,2019,317973,Technology,Computer Software: Programming Data Processing
DPG,Duff & Phelps Utility and Infrastructure Fund Inc.,$11.91,0.06,0.506%,0.00,United States,2011,76989,Finance,Trusts Except Educational Religious and Charitable
DPRO,Draganfly Inc. Common Shares,$2.365,-0.115,-4.637%,9998735.00,Canada,,98678,Industrials,Aerospace
DPZ,Domino's Pizza Inc Common Stock,$489.71,7.43,1.541%,16795442834.00,United States,2004,634298,Consumer Discretionary,Food Distributors
DQ,DAQO New Energy Corp. American Depositary Shares each representing five ordinary shares,$20.25,-1.25,-5.814%,1336650883.00,China,2010,738861,Technology,Semiconductors
DRCT,Direct Digital Holdings Inc. Class A Common Stock,$0.9485,0.0085,0.904%,13912504.00,United States,2022,78635,Consumer Discretionary,Advertising
DRD,DRDGOLD Limited American Depositary Shares,$11.01,-0.02,-0.181%,951912170.00,South Africa,,270208,Basic Materials,Precious Metals
DRDB,Roman DBDR Acquisition Corp. II Ordinary shares,$9.94,-0.01,-0.101%,0.00,United States,2025,8965,,
DRDBU,Roman DBDR Acquisition Corp. II Unit,$10.09,0.00,0.00%,0.00,United States,2024,100,,
DRDBW,Roman DBDR Acquisition Corp. II Warrants,$0.34,0.0202,6.316%,0.00,United States,2025,49179,,
DRH,Diamondrock Hospitality Company Common Stock,$8.23,0.06,0.734%,1708483888.00,United States,2005,6888378,Real Estate,Real Estate Investment Trusts
DRH^A,Diamondrock Hospitality Company 8.250% Series A Cumulative Redeemable Preferred Stock,$25.40,-0.06,-0.236%,,United States,,13113,,
DRI,Darden Restaurants Inc. Common Stock,$200.46,5.54,2.842%,23483244722.00,United States,,1132656,Consumer Discretionary,Restaurants
DRIO,DarioHealth Corp. Common Stock,$0.6959,0.0159,2.338%,23727653.00,Israel,,71777,Health Care,Medical/Dental Instruments
DRMA,Dermata Therapeutics Inc. Common Stock,$1.14,-0.0212,-1.826%,2326476.00,United States,2021,93767,Health Care,Biotechnology: Pharmaceutical Preparations
DRMAW,Dermata Therapeutics Inc. Warrant,$0.0245,-0.0035,-12.50%,49999.00,United States,2021,5004,Health Care,Biotechnology: Pharmaceutical Preparations
DRRX,DURECT Corporation Common Stock,$0.798,0.0197,2.531%,24771501.00,United States,2000,17323,Health Care,Biotechnology: Pharmaceutical Preparations
DRS,Leonardo DRS Inc. Common Stock,$30.45,0.56,1.874%,8050890447.00,Israel,,1038773,Industrials,Industrial Machinery/Components
DRTS,Alpha Tau Medical Ltd. Ordinary Shares,$3.02,0.25,9.025%,210405248.00,Israel,,300774,Health Care,Medical/Dental Instruments
DRTSW,Alpha Tau Medical Ltd. Warrant,$0.2983,0.0204,7.341%,20782744.00,Israel,,88692,Health Care,Medical/Dental Instruments
DRUG,Bright Minds Biosciences Inc. Common Stock,$37.24,3.35,9.885%,260269950.00,Canada,,30160,Health Care,Biotechnology: Pharmaceutical Preparations
DRVN,Driven Brands Holdings Inc. Common Stock,$17.53,1.30,8.01%,2872056299.00,United States,2021,1193012,Consumer Discretionary,Automotive Aftermarket
DSGN,Design Therapeutics Inc. Common Stock,$4.86,0.18,3.846%,275178240.00,United States,2021,108004,Health Care,Biotechnology: Pharmaceutical Preparations
DSGR,Distribution Solutions Group Inc. Common Stock,$29.48,0.17,0.58%,1380780702.00,United States,,41459,Consumer Discretionary,Industrial Specialties
DSGX,Descartes Systems Group Inc. (The) Common Stock,$111.49,1.22,1.106%,9536791831.00,Canada,,254058,Technology,Computer Software: Prepackaged Software
DSL,DoubleLine Income Solutions Fund Common Shares of Beneficial Interests,$12.87,0.05,0.39%,1312699176.00,United States,2013,516392,Finance,Trusts Except Educational Religious and Charitable
DSM,BNY Mellon Strategic Municipal Bond Fund Inc. Common Stock,$6.03,-0.02,-0.331%,0.00,United States,1989,92346,Finance,Investment Managers
DSP,Viant Technology Inc. Class A Common Stock,$19.99,-0.74,-3.57%,1256407942.00,United States,2021,531510,Technology,Computer Software: Programming Data Processing
DSS,DSS Inc. Common Stock,$0.9002,0.0002,0.022%,6361508.00,United States,,5405,Consumer Discretionary,Containers/Packaging
DSU,Blackrock Debt Strategies Fund Inc. Common Stock,$10.70,0.09,0.848%,0.00,United States,1998,281052,Finance,Finance Companies
DSWL,Deswell Industries Inc. Common Shares,$2.3702,-0.0198,-0.828%,37769703.00,Macau,1995,10189,Industrials,Plastic Products
DSX,Diana Shipping inc. common stock,$1.86,-0.01,-0.535%,223131026.00,Greece,2005,217250,Consumer Discretionary,Marine Transportation
DSX^B,Diana Shipping Inc. Perpetual Preferred Shares Series B (Marshall Islands),$26.22,-0.33,-1.243%,,Greece,,1875,,
DSY,Big Tree Cloud Holdings Limited Ordinary Shares,$1.97,0.00,0.00%,112448676.00,China,,11161,Consumer Discretionary,Containers/Packaging
DSYWW,Big Tree Cloud Holdings Limited Warrants,$0.0269,0.0013,5.078%,1535467.00,China,,9448,Consumer Discretionary,Containers/Packaging
DT,Dynatrace Inc. Common Stock,$57.25,-0.06,-0.105%,17137789389.00,United States,2019,2689604,Technology,Computer Software: Prepackaged Software
DTB,DTE Energy Company 2020 Series G 4.375% Junior Subordinated Debentures due 2080,$18.68,-0.06,-0.32%,3871287845.00,United States,2020,11659,Utilities,Electric Utilities: Central
DTC,Solo Brands Inc. Class A Common Stock,$0.7461,0.0045,0.607%,68396188.00,United States,2021,355870,Consumer Discretionary,Recreational Games/Products/Toys
DTCK,Davis Commodities Limited Ordinary Shares,$1.00,0.09,9.89%,24500625.00,Singapore,2023,12617,Industrials,Farming/Seeds/Milling
DTE,DTE Energy Company Common Stock,$133.70,1.86,1.411%,27708307543.00,United States,,1161945,Utilities,Electric Utilities: Central
DTF,DTF Tax-Free Income 2028 Term Fund Inc. Common Stock,$11.35,-0.05,-0.439%,79785585.00,United States,1991,5509,Finance,Investment Managers
DTG,DTE Energy Company 2021 Series E 4.375% Junior Subordinated Debentures,$18.44,-0.08,-0.432%,3821549672.00,United States,2021,17094,Utilities,Electric Utilities: Central
DTI,Drilling Tools International Corporation Common Stock,$3.23,0.09,2.866%,112096168.00,United States,2021,52490,Industrials,Metal Fabrications
DTIL,Precision BioSciences Inc. Common Stock,$5.39,-0.10,-1.821%,41347008.00,United States,2019,130515,Health Care,Biotechnology: Biological Products (No Diagnostic Substances)
DTM,DT Midstream Inc. Common Stock ,$96.09,3.16,3.40%,9739541532.00,United States,2021,2059740,Utilities,Natural Gas Distribution
DTSQ,DT Cloud Star Acquisition Corporation Ordinary Shares,$10.18,0.00,0.00%,0.00,United States,2024,4951,,
DTSQR,DT Cloud Star Acquisition Corporation Right,$0.1591,-0.0159,-9.086%,0.00,United States,2024,21513,,
DTSS,Datasea Inc. Common Stock,$2.18,-0.04,-1.802%,16326896.00,China,,20519,Technology,Computer Software: Prepackaged Software
DTST,Data Storage Corporation Common Stock,$3.97,0.15,3.927%,27847061.00,United States,,22625,Technology,EDP Services
DTSTW,Data Storage Corporation Warrant,$0.395,0.014,3.675%,2770677.00,United States,,6658,Technology,EDP Services
DTW,DTE Energy Company 2017 Series E 5.25% Junior Subordinated Debentures due 2077,$22.66,-0.2015,-0.881%,4696112557.00,United States,2017,30546,Utilities,Electric Utilities: Central
DUK,Duke Energy Corporation (Holding Company) Common Stock,$117.49,1.60,1.381%,90758957763.00,United States,,5403206,Utilities,Power Generation
DUK^A,Duke Energy Corporation Depositary Shares each representing a 1/1000th interest in a share of 5.75% Series A Cumulative Redeemable Perpetual Preferred Stock,$25.00,0.00,0.00%,,United States,,81350,,
DUKB,Duke Energy Corporation 5.625% Junior Subordinated Debentures due 2078,$24.84,-0.02,-0.08%,19188462940.00,United States,2018,46947,Utilities,Power Generation
DUO,Fangdd Network Group Ltd. Class A Ordinary Shares,$0.5036,-0.0164,-3.154%,3207932.00,China,2019,2104746,Finance,Real Estate
DUOL,Duolingo Inc. Class A Common Stock,$312.07,-63.71,-16.954%,13726261015.00,United States,2021,3454351,Technology,Computer Software: Prepackaged Software
DUOT,Duos Technologies Group Inc. Common Stock,$6.04,0.22,3.78%,50800175.00,United States,,60579,Technology,Computer Software: Prepackaged Software
DV,DoubleVerify Holdings Inc. Common Stock,$13.90,-7.83,-36.033%,2351393625.00,United States,2021,14912319,Technology,Computer Software: Programming Data Processing
DVA,DaVita Inc. Common Stock,$147.88,1.14,0.777%,11830400000.00,United States,,1257421,Health Care,Misc Health and Biotechnology Services
DVAX,Dynavax Technologies Corporation Common Stock,$13.79,0.21,1.546%,1710936732.00,United States,2004,1234630,Health Care,Biotechnology: Pharmaceutical Preparations
DVLT,Datavault AI Inc. Common Stock,$0.9147,-0.0491,-5.094%,7105232.00,United States,2018,315769,Technology,Semiconductors
DVN,Devon Energy Corporation Common Stock,$36.22,0.34,0.948%,23506780000.00,United States,1985,9071918,Energy,Oil & Gas Production
DWSN,Dawson Geophysical Company Common Stock,$1.45,0.03,2.113%,44925984.00,United States,,1967,Energy,Oil & Gas Production
DWTX,Dogwood Therapeutics Inc. Common Stock,$4.79,0.08,1.699%,6381133.00,United States,2020,9534,Health Care,Biotechnology: Pharmaceutical Preparations
DX,Dynex Capital Inc. Common Stock,$14.07,0.12,0.86%,1115800583.00,United States,,4779960,Real Estate,Real Estate Investment Trusts
DX^C,Dynex Capital Inc. 6.900% Series C Fixed-to-Floating Rate Cumulative Redeemable Preferred Stock,$25.29,-0.0498,-0.197%,,United States,,11821,,
DXC,DXC Technology Company Common Stock ,$18.37,0.08,0.437%,3325862066.00,United States,,1466802,Technology,EDP Services
DXCM,DexCom Inc. Common Stock,$88.37,0.56,0.638%,34532523231.00,United States,2005,4965831,Health Care,Medical/Dental Instruments
DXF,Eason Technology Limited American Depositary Shares (each representing sixty-thousand (60000) Ordinary Shares),$8.12,-1.10,-11.931%,2025648.00,,,60978,Finance,Finance: Consumer Services
DXLG,Destination XL Group Inc. Common Stock,$2.29,0.04,1.778%,124363573.00,United States,,128413,Consumer Discretionary,Clothing/Shoe/Accessory Stores
DXPE,DXP Enterprises Inc. Common Stock,$90.47,1.55,1.743%,1419916065.00,United States,,154943,Industrials,Industrial Machinery/Components
DXR,Daxor Corporation Common Stock,$7.56,0.06,0.80%,36590400.00,United States,,3767,Health Care,Medical/Dental Instruments
DXST,Decent Holding Inc Ordinary Shares,$1.28,-0.0501,-3.767%,21120000.00,China,2025,46787,Industrials,Miscellaneous
DXYZ,Destiny Tech100 Inc. Common Stock,$40.60,-0.09,-0.221%,0.00,,2024,625897,,
DY,Dycom Industries Inc. Common Stock,$163.86,1.73,1.067%,4780757239.00,United States,,821346,Industrials,Water Sewer Pipeline Comm & Power Line Construction
DYAI,Dyadic International Inc. Common Stock,$1.47,0.03,2.083%,43496375.00,United States,,8327,Health Care,Biotechnology: Biological Products (No Diagnostic Substances)
DYCQ,DT Cloud Acquisition Corporation Ordinary Shares,$10.55,0.00,0.00%,0.00,United Kingdom,2024,102,,
DYCQR,DT Cloud Acquisition Corporation Right,$0.19,-0.04,-17.391%,0.00,United Kingdom,2024,58221,,
DYN,Dyne Therapeutics Inc. Common Stock,$13.61,0.44,3.341%,1385034688.00,United States,2020,1762431,Health Care,Biotechnology: Pharmaceutical Preparations
DYNX,Dynamix Corporation Class A Ordinary Shares,$9.8617,0.0017,0.017%,0.00,United States,2024,543,,
DYNXU,Dynamix Corporation Unit,$10.01,0.02,0.20%,0.00,United States,2024,6220,,
DYNXW,Dynamix Corporation Warrant,$0.25,0.00,0.00%,0.00,United States,2024,4,,
E,ENI S.p.A. Common Stock,$28.97,-0.24,-0.822%,48900460395.00,Italy,,366036,Energy,Oil & Gas Production
EA,Electronic Arts Inc. Common Stock,$129.12,-1.34,-1.027%,33650943737.00,United States,,6204147,Technology,Computer Software: Prepackaged Software
EAD,Allspring Income Opportunities Fund Common Shares,$7.05,0.08,1.148%,0.00,United States,2003,156996,Finance,Finance/Investors Services
EAF,GrafTech International Ltd. Common Stock,$1.17,-0.01,-0.847%,300998541.00,United States,2018,1642582,Energy,Industrial Machinery/Components
EAI,Entergy Arkansas LLC First Mortgage Bonds 4.875% Series Due September 1 2066,$21.34,-0.37,-1.704%,9185004457.00,United States,2016,26258,Utilities,Electric Utilities: Central
EARN,Ellington Credit Company Common Shares of Beneficial Interest,$6.47,-0.06,-0.919%,186338232.00,United States,2013,659676,Real Estate,Real Estate Investment Trusts
EAT,Brinker International Inc. Common Stock,$164.83,9.32,5.993%,7319582239.00,United States,,1122812,Consumer Discretionary,Restaurants
EB,Eventbrite Inc. Class A Common Stock,$2.44,-0.66,-21.29%,236389345.00,United States,2018,5656617,Technology,Computer Software: Programming Data Processing
EBAY,eBay Inc. Common Stock,$64.74,1.26,1.985%,31010460000.00,United States,1998,8587636,Consumer Discretionary,Business Services
EBC,Eastern Bankshares Inc. Common Stock,$17.89,0.22,1.245%,3840328566.00,United States,2020,1086325,Finance,Savings Institutions
EBF,Ennis Inc. Common Stock,$21.20,0.08,0.379%,551467184.00,United States,,237946,Consumer Discretionary,Office Equipment/Supplies/Services
EBMT,Eagle Bancorp Montana Inc. Common Stock,$17.88,0.05,0.28%,143340098.00,United States,2010,24647,Finance,Major Banks
EBON,Ebang International Holdings Inc. Class A Ordinary Shares,$4.31,-0.08,-1.822%,28204373.00,China,2020,8111,Technology,Semiconductors
EBR,Centrais Electricas Brasileiras S A American Depositary Shares (Each representing one Common Share),$6.52,0.12,1.875%,14642709119.00,Brazil,2016,1774930,Utilities,Electric Utilities: Central
EBS,Emergent BioSolutions Inc. Common Stock,$7.48,0.42,5.949%,405297711.00,United States,2006,1011970,Health Care,Biotechnology: Pharmaceutical Preparations
EBTC,Enterprise Bancorp Inc Common Stock,$43.15,0.58,1.362%,536319549.00,United States,,26168,Finance,Major Banks
EC,Ecopetrol S.A. American Depositary Shares,$9.88,-0.03,-0.303%,20311647182.00,Colombia,,3430169,Energy,Oil & Gas Production
