Symbol,Name,Last Sale,Net Change,% Change,Market Cap,Country,IPO Year,Volume,Sector,Industry
PRTS,CarParts.com Inc. Common Stock,$0.9694,-0.0121,-1.233%,55643214.00,United States,2007,460841,Consumer Discretionary,Auto & Home Supply Stores
PRU,Prudential Financial Inc. Common Stock,$115.10,2.35,2.084%,40745400000.00,United States,2001,2931865,Finance,Life Insurance
PRVA,Privia Health Group Inc. Common Stock,$24.97,-0.49,-1.925%,2996433834.00,United States,2021,1880484,Health Care,Medical/Nursing Services
PRZO,ParaZero Technologies Ltd. Ordinary Shares,$0.8301,-0.0299,-3.477%,9263916.00,Israel,2023,360429,Industrials,Military/Government/Technical
PSA,Public Storage Common Stock,$303.62,-2.08,-0.68%,53259663219.00,United States,,1074729,Real Estate,Real Estate Investment Trusts
PSA^F,Public Storage Depositary Shares Each Representing 1/1000 of a 5.15% Cumulative Preferred Share of Beneficial Interest Series F par value $0.01 per share,$22.26,0.01,0.045%,,United States,,23652,,
PSA^G,Public Storage Depositary Shares Each Representing 1/1000 of a 5.05% Cumulative Preferred Share of Beneficial Interest Series G,$22.10,0.00,0.00%,,United States,,15530,,
PSA^H,Public Storage Depositary Shares Each Representing 1/1000 of a  5.60% Cumulative Preferred  Share of Beneficial Interest Series H,$24.16,-0.04,-0.165%,,United States,,31709,,
PSA^I,Public Storage Depositary Shares Each Representing 1/1000 of a 4.875% Cumulative Preferred Share of Beneficial Interest Series I par value $0.01 per share,$20.89,-0.07,-0.334%,,United States,,21833,,
PSA^J,Public Storage Depositary Shares Each Representing 1/1000 of a 4.700% Cumulative Preferred Share of Beneficial Interest Series J par value $0.01 per share,$20.09,-0.01,-0.05%,,United States,,33774,,
PSA^K,Public Storage Depositary Shares Each Representing 1/1000 of a 4.75% Cumulative Preferred Share of Beneficial Interest Series K,$20.36,-0.015,-0.074%,,United States,,11944,,
PSA^L,Public Storage Depositary Shares Each Representing 1/1000 of a 4.625% Cumulative Preferred Share of Beneficial Interest Series L par value $0.01 per share,$19.82,0.01,0.05%,,United States,,57577,,
PSA^M,Public Storage Depositary Shares Each Representing 1/1000 of a 4.125% Cumulative Preferred Share of Beneficial Interest Series M,$17.71,-0.03,-0.169%,,United States,,5065,,
PSA^N,Public Storage Depositary Shares Each Representing 1/1000 of a 3.875% Cumulative Preferred Share of Beneficial Interest Series N,$16.72,0.05,0.30%,,United States,,35481,,
PSA^O,Public Storage Depositary Shares Each Representing 1/1000 of a 3.900% Cumulative Preferred Share of Beneficial Interest Series O,$16.87,0.1249,0.746%,,United States,,109563,,
PSA^P,Public Storage Depositary Shares Each Representing 1/1000 of a 4.000% Cumulative Preferred Share of Bene cial Interest Series P,$17.26,0.02,0.116%,,United States,,49835,,
PSA^Q,Public Storage Depositary Shares Each Representing 1/1000 of a 3.950% Cumulative Preferred Share of Beneficial Interest Series Q par value $0.01 per share,$16.89,0.025,0.148%,,United States,,59329,,
PSA^R,Public Storage Depositary Shares Each Representing 1/1000 of a 4.00% Cumulative Preferred Share of Bene cial Interest Series R,$17.17,0.00,0.00%,,United States,,39293,,
PSA^S,Public Storage Depositary Shares Each Representing 1/1000 of a 4.100% Cumulative Preferred Share of Beneficial Interest Series S,$17.58,-0.02,-0.114%,,United States,,12750,,
PSBD,Palmer Square Capital BDC Inc. Common Stock,$15.35,-0.07,-0.454%,0.00,,2024,55782,,
PSEC,Prospect Capital Corporation Common Stock,$4.40,0.09,2.088%,1948077754.00,United States,2004,2505887,Finance,Finance: Consumer Services
PSEC^A,Prospect Capital Corporation 5.35% Series A Fixed Rate Cumulative Perpetual Preferred Stock,$16.55,-0.70,-4.058%,,United States,,78593,,
PSF,Cohen & Steers Select Preferred and Income Fund Inc. Common Stock,$20.34,0.11,0.544%,999479694.00,,2010,31553,Finance,Investment Managers
PSFE,Paysafe Limited Common Shares,$19.80,0.56,2.911%,1222044971.00,,2021,354842,Consumer Discretionary,Business Services
PSHG,Performance Shipping Inc. Common Shares,$1.59,-0.02,-1.242%,19524685.00,Greece,,20070,Consumer Discretionary,Marine Transportation
PSIG,PS International Group Ltd. Ordinary Shares,$0.4701,-0.0109,-2.266%,11415409.00,Hong Kong,,176686,Consumer Discretionary,Oil Refining/Marketing
PSIX,Power Solutions International Inc. Common Stock,$33.37,0.13,0.391%,767497186.00,United States,,178240,Industrials,Industrial Machinery/Components
PSMT,PriceSmart Inc. Common Stock,$89.39,0.23,0.258%,2740907020.00,United States,,213976,Consumer Discretionary,Department/Specialty Retail Stores
PSN,Parsons Corporation Common Stock,$58.22,-0.72,-1.222%,6216564276.00,United States,2019,1323487,Technology,EDP Services
PSNL,Personalis Inc. Common Stock,$4.14,-0.10,-2.358%,292483068.00,United States,2019,1363599,Health Care,Medical Specialities
PSNY,Polestar Automotive Holding UK PLC Class A ADS,$1.09,-0.02,-1.802%,2327379214.00,Sweden,,4983064,Consumer Discretionary,Auto Manufacturing
PSNYW,Polestar Automotive Holding UK PLC Class C-1 ADS (ADW),$0.1897,0.0021,1.119%,405049392.00,Sweden,,40732,Consumer Discretionary,Auto Manufacturing
PSO,Pearson Plc Common Stock,$17.26,0.40,2.372%,11499730983.00,United Kingdom,,548537,Consumer Discretionary,Books
PSQH,PSQ Holdings Inc. Class A Common Stock,$2.66,-0.06,-2.206%,92467511.00,,2021,581083,Consumer Discretionary,Advertising
PSTG,Pure Storage Inc. Class A Common Stock,$52.47,-0.73,-1.372%,17117653921.00,United States,2015,5723144,Technology,Electronic Components
PSTL,Postal Realty Trust Inc. Class A Common Stock,$13.93,-0.11,-0.783%,326705361.00,United States,2019,371489,Real Estate,Real Estate Investment Trusts
PSTV,PLUS THERAPEUTICS Inc. Common Stock ,$0.725,0.05,7.407%,4274841.00,United States,,1132389,Health Care,Medical/Dental Instruments
PSX,Phillips 66 Common Stock,$129.69,2.28,1.789%,52874398622.00,United States,,5739901,Energy,Integrated oil Companies
PT,Pintec Technology Holdings Limited American Depositary Shares,$1.015,0.033,3.36%,16187180.00,China,2018,5000,Technology,Computer Software: Programming Data Processing
PTA,Cohen & Steers Tax-Advantaged Preferred Securities and Income Fund Common Shares of Beneficial Interest,$19.93,0.05,0.252%,1101599998.00,United States,2020,106595,Finance,Trusts Except Educational Religious and Charitable
PTC,PTC Inc. Common Stock,$163.63,0.88,0.541%,19688541177.00,United States,,1541980,Technology,Computer Software: Prepackaged Software
PTCT,PTC Therapeutics Inc. Common Stock,$55.26,4.69,9.274%,4261935402.00,United States,2013,1921413,Health Care,Biotechnology: Pharmaceutical Preparations
PTEN,Patterson-UTI Energy Inc. Common Stock,$8.31,0.20,2.466%,3210903368.00,United States,1993,8508417,Energy,Oil & Gas Production
PTGX,Protagonist Therapeutics Inc. Common Stock,$37.59,1.25,3.44%,2307435424.00,United States,2016,720436,Health Care,Biotechnology: Pharmaceutical Preparations
PTHL,Pheton Holdings Ltd Class A Ordinary Shares,$1.9747,-0.0753,-3.673%,28633150.00,China,2024,3067,Health Care,Biotechnology: Electromedical & Electrotherapeutic Apparatus
PTIX,Protagenic Therapeutics Inc. Common Stock,$0.305,0.0169,5.866%,2072420.00,United States,,580508,Health Care,Biotechnology: Pharmaceutical Preparations
PTIXW,Protagenic Therapeutics Inc. Warrant,$0.0045,0.0005,12.50%,30577.00,United States,,1000,Health Care,Biotechnology: Pharmaceutical Preparations
PTLE,PTL LTD Ordinary Shares,$1.16,-0.03,-2.521%,14500000.00,Singapore,2024,76481,Energy,Oil Refining/Marketing
PTLO,Portillo's Inc. Class A Common Stock,$13.97,-0.01,-0.072%,1042197302.00,United States,2021,2035157,Consumer Discretionary,Restaurants
PTMN,Portman Ridge Finance Corporation Common Stock,$17.45,0.08,0.461%,160766484.00,United States,2006,33482,Finance,Finance: Consumer Services
PTN,Palatin Technologies Inc. Common Stock,$0.9129,0.0079,0.873%,23740737.00,United States,1999,452264,Health Care,Biotechnology: Pharmaceutical Preparations
PTON,Peloton Interactive Inc. Class A Common Stock,$7.53,0.10,1.346%,2936432655.00,United States,2019,12524588,Consumer Discretionary,Recreational Games/Products/Toys
PTPI,Petros Pharmaceuticals Inc. Common Stock,$0.0978,-0.005,-4.864%,979454.00,United States,,3497676,Health Care,Biotechnology: Pharmaceutical Preparations
PTVE,Pactiv Evergreen Inc. Common stock,$17.86,0.03,0.168%,3226061337.00,United States,2020,297056,Consumer Discretionary,Containers/Packaging
PTY,Pimco Corporate & Income Opportunity Fund,$14.71,0.04,0.273%,0.00,United States,2002,810612,Finance,Investment Managers
PUBM,PubMatic Inc. Class A Common Stock,$10.63,-3.34,-23.908%,507760489.00,United States,2020,1866173,Technology,Computer Software: Programming Data Processing
PUK,Prudential Public Limited Company Common Stock,$18.39,0.08,0.437%,24318508690.00,United Kingdom,,1056542,Finance,Life Insurance
PULM,Pulmatrix Inc. Common Stock,$8.08,0.36,4.663%,29510463.00,United States,2014,15733,Health Care,Biotechnology: Pharmaceutical Preparations
PUMP,ProPetro Holding Corp. Common Stock,$8.44,-0.02,-0.236%,870743457.00,United States,2017,2253442,Energy,Oilfield Services/Equipment
PVBC,Provident Bancorp Inc. (MD) Common Stock,$12.03,0.27,2.296%,213292417.00,United States,2015,15959,Finance,Banks
PVH,PVH Corp. Common Stock,$74.84,-0.04,-0.053%,4163588538.00,United States,,1116215,Consumer Discretionary,Apparel
PVL,Permianville Royalty Trust Trust Units ,$1.45,-0.01,-0.685%,47850000.00,United States,2011,79663,Energy,Oil & Gas Production
PVLA,Palvella Therapeutics Inc. Common Stock,$19.37,0.52,2.759%,25573049.00,United States,,13817,Health Care,Biotechnology: Pharmaceutical Preparations
PW,Power REIT (MD) Common Stock,$1.1499,0.0099,0.868%,3897771.00,United States,1998,18459,Real Estate,Real Estate Investment Trusts
PW^A,Power REIT 7.75% Series A Cumulative Perpetual Preferred Stock,$7.17,-0.2652,-3.567%,,United States,,3435,,
PWM,Prestige Wealth Inc. Class A Ordinary Shares,$0.59,-0.041,-6.498%,18668756.00,Hong Kong,2023,113811,Finance,Finance: Consumer Services
PWOD,Penns Woods Bancorp Inc. Common Stock,$30.56,0.76,2.55%,230560867.00,United States,,19599,Finance,Major Banks
PWP,Perella Weinberg Partners Class A Common Stock,$23.11,1.00,4.523%,2037457953.00,United States,2020,895100,Finance,Finance: Consumer Services
PWR,Quanta Services Inc. Common Stock,$259.63,0.37,0.143%,38476730081.00,United States,,3038924,Industrials,Engineering & Construction
PX,P10 Inc. Class A Common Stock,$12.77,0.11,0.869%,1425422581.00,United States,2021,677534,Finance,Investment Managers
PXLW,Pixelworks Inc.  Common Stock,$0.7383,-0.0117,-1.56%,43514227.00,United States,2000,263350,Technology,Semiconductors
PXS,Pyxis Tankers Inc. Common Stock,$3.53,0.00,0.00%,37215191.00,Greece,,5293,Consumer Discretionary,Marine Transportation
PXSAW,Pyxis Tankers Inc. Warrant,$0.0907,-0.0158,-14.836%,956209.00,Greece,,3983,Consumer Discretionary,Marine Transportation
PYCR,Paycor HCM Inc. Common Stock,$22.33,0.21,0.949%,4058967599.00,United States,2021,2401616,Technology,Computer Software: Prepackaged Software
PYN,PIMCO New York Municipal Income Fund III Common Shares of Beneficial Interest,$5.98,0.04,0.673%,0.00,United States,2002,14920,Finance,Investment Managers
PYPD,PolyPid Ltd. Ordinary Shares,$3.23,0.31,10.616%,32916620.00,Israel,2020,12949,Health Care,Biotechnology: Pharmaceutical Preparations
PYPL,PayPal Holdings Inc. Common Stock,$71.05,0.32,0.452%,70285676215.00,United States,,13590278,Consumer Discretionary,Business Services
PYXS,Pyxis Oncology Inc. Common Stock,$1.19,0.06,5.31%,70764218.00,United States,2021,479839,Health Care,Biotechnology: Pharmaceutical Preparations
PZC,PIMCO California Municipal Income Fund III Common Shares of Beneficial Interest,$6.93,0.02,0.289%,0.00,United States,2002,41542,Finance,Investment Managers
PZG,Paramount Gold Nevada Corp. Common Stock,$0.359,0.003,0.843%,24269365.00,United States,2015,153592,Basic Materials,Metal Mining
PZZA,Papa John's International Inc. Common Stock,$45.35,-1.54,-3.284%,1480297603.00,United States,1993,1459569,Consumer Discretionary,Restaurants
QBTS,D-Wave Quantum Inc. Common Shares,$5.48,-0.08,-1.439%,1227601263.00,,2022,45482168,Technology,EDP Services
QCOM,QUALCOMM Incorporated Common Stock,$157.17,2.73,1.768%,173830020000.00,United States,1991,10146084,Technology,Radio And Television Broadcasting And Communications Equipment
QCRH,QCR Holdings Inc. Common Stock,$75.33,0.64,0.857%,1270736572.00,United States,,100638,Finance,Major Banks
QD,Qudian Inc. American Depositary Shares each representing one Class A Ordinary Share,$2.79,-0.01,-0.357%,528436744.00,China,2017,403249,Finance,Finance: Consumer Services
QDEL,QuidelOrtho Corporation Common Stock,$39.99,0.21,0.528%,2689596113.00,United States,,821692,Health Care,Biotechnology: In Vitro & In Vivo Diagnostic Substances
QETA,Quetta Acquisition Corporation Common Stock,$10.70,0.03,0.281%,0.00,United States,2023,687,Finance,Blank Checks
QETAR,Quetta Acquisition Corporation Right,$1.33,-0.12,-8.276%,0.00,United States,2023,446,Finance,Blank Checks
QFIN,Qifu Technology Inc. American Depositary Shares,$40.08,-1.32,-3.188%,6222599358.00,China,2018,1899025,Finance,Finance: Consumer Services
QGEN,Qiagen N.V. Common Shares,$38.40,0.00,0.00%,8263984282.00,Netherlands,,1055052,Health Care,Biotechnology: Biological Products (No Diagnostic Substances)
QH,Quhuo Limited American Depository Shares,$1.47,-0.01,-0.676%,9066403.00,China,2020,5080,Consumer Discretionary,Business Services
QIPT,Quipt Home Medical Corp. Common Shares,$2.64,-0.03,-1.124%,113760961.00,United States,,112770,Health Care,Misc Health and Biotechnology Services
QLGN,Qualigen Therapeutics Inc. Common Stock,$3.17,-0.07,-2.16%,2334486.00,United States,2015,16750,Health Care,Biotechnology: Pharmaceutical Preparations
QLYS,Qualys Inc. Common Stock,$131.46,0.34,0.259%,4795354761.00,United States,2012,341037,Technology,Computer Software: Prepackaged Software
QMCO,Quantum Corporation Common Stock,$11.79,-0.16,-1.339%,68785206.00,United States,,414439,Technology,Electronic Components
QMMM,QMMM Holdings Limited Ordinary Shares,$0.915,0.1348,17.278%,15743803.00,Hong Kong,2024,1038630,Consumer Discretionary,Advertising
QNCX,Quince Therapeutics Inc. Common Stock,$1.45,0.06,4.317%,63802382.00,United States,2019,47846,Health Care,Biotechnology: Biological Products (No Diagnostic Substances)
QNRX,Quoin Pharmaceuticals Ltd. American Depositary Shares,$0.3107,-0.0445,-12.528%,1568948.00,Israel,2016,4715297,Health Care,Medical/Dental Instruments
QNST,QuinStreet Inc. Common Stock,$19.58,0.28,1.451%,1105655188.00,United States,2010,542285,Consumer Discretionary,Business Services
QNTM,Quantum Biopharma Ltd. Class B Subordinate Voting Shares,$4.55,-0.39,-7.895%,5917184.00,Canada,,175118,Health Care,Biotechnology: Pharmaceutical Preparations
QQQX,Nuveen NASDAQ 100 Dynamic Overwrite Fund Shares of Beneficial Interest,$25.91,0.18,0.70%,0.00,United States,,168250,Finance,Finance Companies
QRHC,Quest Resource Holding Corporation Common Stock,$4.57,0.12,2.697%,94085675.00,United States,,35877,Utilities,Environmental Services
QRVO,Qorvo Inc. Common Stock,$72.69,1.73,2.438%,6789015718.00,United States,,7175470,Technology,Semiconductors
QS,QuantumScape Corporation Class A Common Stock,$4.69,-0.11,-2.292%,2565002816.00,United States,2020,19864005,Miscellaneous,Industrial Machinery/Components
QSG,QuantaSing Group Limited American Depositary Shares,$2.32,-0.09,-3.734%,118582167.00,China,2023,75188,Real Estate,Other Consumer Services
QSI,Quantum-Si Incorporated Class A Common Stock,$1.38,0.03,2.222%,196943736.00,United States,2020,6678525,Industrials,Industrial Machinery/Components
QSIAW,Quantum-Si Incorporated Warrant,$0.493,0.017,3.571%,70357436.00,United States,2020,16322,Industrials,Industrial Machinery/Components
QSR,Restaurant Brands International Inc. Common Shares,$65.25,0.06,0.092%,29494515236.00,Canada,2014,1889736,Consumer Discretionary,Restaurants
QTRX,Quanterix Corporation Common Stock,$7.59,0.11,1.471%,292399634.00,United States,2017,1492853,Industrials,Biotechnology: Laboratory Analytical Instruments
QTTB,Q32 Bio Inc. Common Stock,$2.27,0.03,1.339%,27650191.00,United States,2018,204949,Health Care,Biotechnology: Pharmaceutical Preparations
QTWO,Q2 Holdings Inc. Common Stock,$87.37,2.30,2.704%,5305804137.00,United States,2014,799199,Technology,Computer Software: Prepackaged Software
QUAD,Quad Graphics Inc Class A Common Stock,$6.28,0.29,4.841%,328743525.00,United States,,288754,Consumer Discretionary,Publishing
QUBT,Quantum Computing Inc. Common Stock,$6.065,-0.12,-1.94%,600959477.00,United States,,9584679,Technology,Computer Software: Prepackaged Software
QUIK,QuickLogic Corporation Common Stock,$6.15,0.065,1.068%,90448493.00,United States,1999,358015,Technology,Semiconductors
QURE,uniQure N.V. Ordinary Shares,$13.15,1.08,8.948%,640972291.00,Netherlands,2014,1239827,Health Care,Biotechnology: Pharmaceutical Preparations
QVCC,QVC Inc. 6.250% Senior Secured Notes due 2068,$11.79,-0.595,-4.804%,12.00,United States,2019,31487,Consumer Discretionary,Catalog/Specialty Distribution
QVCD,QVC Inc. 6.375% Senior Secured Notes due 2067,$12.00,-0.55,-4.382%,12.00,United States,2018,16230,Consumer Discretionary,Catalog/Specialty Distribution
QVCGA,QVC Group Inc. Series A Common Stock,$0.3337,-0.0664,-16.596%,0.00,United States,,5731182,,
QVCGB,QVC Group Inc. Series B Common Stock,$9.99,1.49,17.529%,0.00,United States,,850510,,
QVCGP,QVC Group Inc. 8.0% Fixed Rate Cumulative Redeemable Preferred Stock,$35.97,-0.18,-0.498%,0.00,United States,,58205,,
QXO,QXO Inc. Common Stock,$12.74,0.43,3.493%,5216140684.00,United States,,3221753,Technology,EDP Services
R,Ryder System Inc. Common Stock,$164.47,4.83,3.026%,6921708108.00,United States,,441199,Consumer Discretionary,Rental/Leasing Companies
RA,Brookfield Real Assets Income Fund Inc. Common Stock,$13.35,0.04,0.301%,0.00,United States,2016,137852,Finance,Investment Managers
RACE,Ferrari N.V. Common Shares,$464.57,4.07,0.884%,112601177662.00,Italy,2015,572776,Consumer Discretionary,Auto Manufacturing
RADX,Radiopharm Theranostics Limited American Depositary Shares,$5.00,-0.11,-2.153%,0.00,Australia,,16870,,
RAIL,FreightCar America Inc. Common Stock,$8.11,0.33,4.242%,153230113.00,United States,2005,198594,Industrials,Railroads
RAIN,Rain Enhancement Technologies Holdco Inc. Class A Common Stock,$2.30,-0.2485,-9.751%,15240630.00,United States,,19601,Technology,Industrial Machinery/Components
RAINW,Rain Enhancement Technologies Holdco Inc. Warrants,$0.0981,-0.0129,-11.622%,650046.00,United States,,19561,Technology,Industrial Machinery/Components
RAMP,LiveRamp Holdings Inc. Common Stock,$29.88,0.35,1.185%,1964929417.00,United States,2018,850742,Technology,EDP Services
RAND,Rand Capital Corporation Common Stock,$22.45,-3.05,-11.961%,57943921.00,United States,,43920,Finance,Finance: Consumer Services
RANG,Range Capital Acquisition Corp. Ordinary Shares,$10.00,-0.01,-0.10%,0.00,United States,2025,2108,,
RANGR,Range Capital Acquisition Corp. Rights,$0.23,-0.0202,-8.074%,0.00,United States,2025,81065,,
RANGU,Range Capital Acquisition Corp. Units,$10.24,0.0301,0.295%,0.00,United States,2024,1935,,
RANI,Rani Therapeutics Holdings Inc. Class A Common Stock,$1.53,0.03,2.00%,87651683.00,United States,2021,190688,Health Care,Biotechnology: Pharmaceutical Preparations
RAPP,Rapport Therapeutics Inc. Common Stock,$10.03,-0.71,-6.611%,366861864.00,United States,2024,455530,Health Care,Biotechnology: Pharmaceutical Preparations
RAPT,RAPT Therapeutics Inc. Common Stock,$1.14,0.05,4.587%,39852408.00,United States,2019,331520,Health Care,Biotechnology: Pharmaceutical Preparations
RARE,Ultragenyx Pharmaceutical Inc. Common Stock,$42.92,0.95,2.264%,3970148328.00,United States,2014,910491,Health Care,Biotechnology: Pharmaceutical Preparations
RAVE,Rave Restaurant Group Inc. Common Stock,$3.21,0.42,15.054%,47224127.00,United States,,90080,Consumer Discretionary,Food Distributors
RAY,Raytech Holding Limited Ordinary Shares,$1.035,0.075,7.813%,18229541.00,Hong Kong,2024,6583,Consumer Discretionary,Consumer Electronics/Appliances
RAYA,Erayak Power Solution Group Inc. Class A Ordinary Shares,$1.28,-0.015,-1.158%,15936000.00,China,2022,15947,Consumer Discretionary,Metal Fabrications
RBA,RB Global Inc. Common Stock,$102.38,1.95,1.942%,18863925032.00,Canada,,1321986,Consumer Discretionary,Business Services
RBB,RBB Bancorp Common Stock,$17.71,0.21,1.20%,313350397.00,United States,2017,16864,Finance,Major Banks
RBBN,Ribbon Communications Inc. Common Stock,$4.72,-0.01,-0.211%,827811003.00,United States,,793951,Technology,EDP Services
RBC,RBC Bearings Incorporated Common Stock,$359.20,1.58,0.442%,11294772804.00,United States,2022,160618,Industrials,Metal Fabrications
RBCAA,Republic Bancorp Inc. Class A Common Stock,$67.83,0.37,0.548%,1319011192.00,United States,1998,20746,Finance,Major Banks
RBKB,Rhinebeck Bancorp Inc. Common Stock,$10.25,0.0794,0.781%,113647972.00,United States,2019,3005,Finance,Banks
RBLX,Roblox Corporation Class A Common Stock,$63.64,3.21,5.312%,42466971045.00,United States,2021,13448045,Technology,Computer Software: Prepackaged Software
RBOT,Vicarious Surgical Inc. Class A Common Stock,$11.00,-0.80,-6.78%,64990409.00,Hong Kong,2020,29628,Health Care,Industrial Specialties
RBRK,Rubrik Inc. Class A Common Stock,$65.12,0.82,1.275%,12063071828.00,United States,2024,1685163,Technology,Computer Software: Prepackaged Software
RC,Ready Capital Corporation Common Stock,$6.93,0.13,1.912%,1167917779.00,United States,2013,2270051,Real Estate,Real Estate Investment Trusts
RC^C,Ready Capital Corporation 6.25% Series C Cumulative Convertible Preferred Stock,$17.25,-0.2499,-1.428%,,United States,,613,,
RC^E,Ready Capital Corporation 6.50% Series E Cumulative Redeemable Preferred Stock,$17.56,-0.21,-1.182%,,United States,,87548,,
RCAT,Red Cat Holdings Inc. Common Stock,$6.20,-0.10,-1.587%,496996848.00,United States,,5741489,Technology,Computer Software: Prepackaged Software
RCB,Ready Capital Corporation 6.20% Senior Notes due 2026,$24.10,0.01,0.042%,4061589966.00,United States,2019,33644,Real Estate,Real Estate Investment Trusts
RCC,Ready Capital Corporation 5.75% Senior Notes due 2026,$24.59,0.07,0.285%,4144170011.00,United States,2021,5281,Real Estate,Real Estate Investment Trusts
RCD,Ready Capital Corporation 9.00% Senior Notes due 2029,$24.79,-0.46,-1.822%,0.00,United States,2024,51789,Real Estate,Real Estate Investment Trusts
RCEL,Avita Medical Inc. Common Stock,$9.10,0.20,2.247%,239853632.00,United States,,155061,Health Care,Medical/Dental Instruments
RCG,RENN Fund Inc Common Stock,$2.70,0.00,0.00%,0.00,United States,,5026,Finance,Investment Managers
RCI,Rogers Communication Inc. Common Stock,$27.76,-0.14,-0.502%,14836821825.00,Canada,,804254,Telecommunications,Cable & Other Pay Television Services
RCKT,Rocket Pharmaceuticals Inc. Common Stock,$9.45,0.05,0.532%,861434453.00,United States,2015,1975432,Health Care,Biotechnology: Pharmaceutical Preparations
RCKTW,Rocket Pharmaceuticals Inc. Warrant,$0.063,-0.0063,-9.091%,5742896.00,United States,,77738,Health Care,Biotechnology: Pharmaceutical Preparations
RCKY,Rocky Brands Inc. Common Stock,$20.34,0.34,1.70%,151610577.00,United States,1993,74413,Consumer Discretionary,Shoe Manufacturing
RCL,Royal Caribbean Cruises Ltd. Common Stock,$246.10,7.94,3.334%,66232586359.00,United States,1993,4457352,Consumer Discretionary,Marine Transportation
RCMT,RCM Technologies Inc. Common Stock,$18.70,-0.05,-0.267%,142064424.00,United States,,43365,Consumer Discretionary,Professional Services
RCON,Recon Technology Ltd. Class A Ordinary Shares,$1.92,-0.036,-1.84%,28968881.00,China,2009,3676,Energy,Oilfield Services/Equipment
RCS,PIMCO Strategic Income Fund Inc.,$6.19,0.05,0.814%,0.00,United States,1994,131749,Finance,Investment Managers
RCUS,Arcus Biosciences Inc. Common Stock,$10.89,1.01,10.223%,1152613086.00,United States,2018,1786269,Health Care,Biotechnology: Pharmaceutical Preparations
RDAC,Rising Dragon Acquisition Corp. Ordinary Shares,$10.10,0.00,0.00%,0.00,China,2024,1,,
RDCM,Radcom Ltd. Ordinary Shares,$12.13,0.15,1.252%,185682789.00,Israel,1997,100733,Technology,Computer peripheral equipment
RDDT,Reddit Inc. Class A Common Stock,$161.78,2.00,1.252%,29266705581.00,United States,2024,9352966,Technology,EDP Services
RDFN,Redfin Corporation Common Stock,$6.67,-0.97,-12.696%,826949762.00,United States,2017,17776661,Finance,Real Estate
RDHL,Redhill Biopharma Ltd. American Depositary Shares,$3.33,-0.27,-7.50%,4264195.00,Israel,,53660,Health Care,Biotechnology: Pharmaceutical Preparations
RDI,Reading International Inc Class A Common Stock,$1.44,0.04,2.857%,32293705.00,United States,,4752,Consumer Discretionary,Movies/Entertainment
RDIB,Reading International Inc Class B Common Stock,$5.81,-1.05,-15.306%,130296129.00,United States,,167,Consumer Discretionary,Movies/Entertainment
RDN,Radian Group Inc. Common Stock,$32.91,0.17,0.519%,4774028102.00,United States,,1795417,Finance,Property-Casualty Insurers
RDNT,RadNet Inc. Common Stock,$55.47,-2.13,-3.698%,4106263101.00,United States,,3037088,Health Care,Medical Specialities
RDUS,Radius Recycling Inc. Class A Common Stock,$13.83,0.34,2.52%,389388961.00,United States,,1344293,Consumer Discretionary,Industrial Specialties
RDVT,Red Violet Inc. Common Stock ,$40.62,2.60,6.839%,560216904.00,United States,,273221,Technology,Computer Software: Prepackaged Software
RDW,Redwire Corporation Common Stock,$13.97,-0.06,-0.428%,929575968.00,United States,2021,2355640,Industrials,Military/Government/Technical
RDWR,Radware Ltd. Ordinary Shares,$21.64,-0.90,-3.993%,902363677.00,Israel,1999,311940,Consumer Discretionary,Business Services
